{
  "domain": "food-claim-approval",
  "exported_at": "2026-09-30T09:00:00+08:00",
  "verified": true,
  "events": [
    {
      "seq": 0,
      "type": "entity.registered",
      "at": "2026-03-01T10:00:00+08:00",
      "actor": "u-linzhiyao",
      "payload": {
        "kind": "category",
        "id": "CAT-BEVERAGE",
        "version": 1,
        "data": {
          "name": "风味饮料（普通食品）",
          "ordinary_food": true,
          "note": "非保健食品、非药品，不得宣称疾病预防治疗或保健功效"
        }
      },
      "prev_hash": "GENESIS",
      "hash": "7218b0d77660ac13e3b48165237e94bc59931a8e1726d3ae83419fb86b553f1b"
    },
    {
      "seq": 1,
      "type": "entity.registered",
      "at": "2026-03-01T10:10:00+08:00",
      "actor": "u-hewenshan",
      "payload": {
        "kind": "recipe",
        "id": "RC-TANG",
        "version": 1,
        "data": {
          "name": "棠参饮配方",
          "ingredients": [
            {
              "name": "饮用水",
              "per_100g": 85,
              "unit": "g"
            },
            {
              "name": "棠梨原汁",
              "per_100g": 10,
              "unit": "g"
            },
            {
              "name": "人参（人工种植，5年及以下）",
              "per_100g": 0.3,
              "unit": "g"
            },
            {
              "name": "蜂蜜",
              "per_100g": 4,
              "unit": "g"
            }
          ],
          "flavorings": [
            "棠梨香精"
          ]
        }
      },
      "prev_hash": "7218b0d77660ac13e3b48165237e94bc59931a8e1726d3ae83419fb86b553f1b",
      "hash": "9fcd575d6fb8ddf883b239490e1811c5c1376b348ea5977fde09e14ab3b15989"
    },
    {
      "seq": 2,
      "type": "entity.registered",
      "at": "2026-03-01T10:20:00+08:00",
      "actor": "u-weilan",
      "payload": {
        "kind": "trademark",
        "id": "TM-TANGSHEN",
        "version": 1,
        "data": {
          "name": "棠参",
          "reg_no_fictional": "TM-X-000001",
          "status": "registered",
          "status_label": "已注册",
          "applicant_fictional": "虚构棠果食品公司"
        }
      },
      "prev_hash": "9fcd575d6fb8ddf883b239490e1811c5c1376b348ea5977fde09e14ab3b15989",
      "hash": "d8d34336a30f2b16481f38697194940b715315efbb055e7b806ad5a86fb6fb50"
    },
    {
      "seq": 3,
      "type": "entity.registered",
      "at": "2026-03-01T10:30:00+08:00",
      "actor": "u-weilan",
      "payload": {
        "kind": "regulation",
        "id": "REG-CN-FOODAD",
        "version": 1,
        "data": {
          "title": "普通食品营销表述规范（虚构示例）",
          "status": "in_force",
          "rules": [
            "普通食品不得标注或暗示疾病预防、治疗功能",
            "不得借助名称、图案混淆为药品",
            "成分定量宣称须与真实投料一致"
          ]
        }
      },
      "prev_hash": "d8d34336a30f2b16481f38697194940b715315efbb055e7b806ad5a86fb6fb50",
      "hash": "ed15c250df67591eb5ca7b0219730a282a8ffa81f0aea30a2d360dff5ad8a715"
    },
    {
      "seq": 4,
      "type": "entity.registered",
      "at": "2026-03-02T09:00:00+08:00",
      "actor": "u-weilan",
      "payload": {
        "kind": "legal_opinion",
        "id": "LO-01",
        "version": 1,
        "data": {
          "title": "棠参饮包装表述法律意见（首版）",
          "conclusions": [
            {
              "claim_key": "C1",
              "claim_text": "人参配方（人工种植人参0.3g/100g）",
              "decision": "permitted",
              "basis_regulation": "regulation/REG-CN-FOODAD@v1",
              "note": "含量必须与真实配方一致；人工种植5年及以下人参可作为普通食品原料"
            },
            {
              "claim_key": "C2",
              "claim_text": "提神抗疲劳，熬夜必备",
              "decision": "prohibited",
              "basis_regulation": "regulation/REG-CN-FOODAD@v1",
              "reason": "抗疲劳属保健功能暗示，普通食品不得使用，抽检合格报告不能替代该结论"
            },
            {
              "claim_key": "C4",
              "claim_text": "以「棠参」为商品名（与虚构药品「棠参片」近似）",
              "decision": "permitted_with_conditions",
              "basis_regulation": "regulation/REG-CN-FOODAD@v1",
              "required_markings": [
                "本品为普通食品，不能代替药物"
              ],
              "note": "可使用名称近似商标，但正面必须同屏显著标注普通食品身份，禁止任何疗效字样"
            }
          ]
        }
      },
      "prev_hash": "ed15c250df67591eb5ca7b0219730a282a8ffa81f0aea30a2d360dff5ad8a715",
      "hash": "2f5bdc1ccdb66f51d031ac51033fe4300d625b3014af4290df71d96e060b3f5f"
    },
    {
      "seq": 5,
      "type": "entity.registered",
      "at": "2026-03-05T14:00:00+08:00",
      "actor": "u-wrenyue",
      "payload": {
        "kind": "test_report",
        "id": "TR-Q1-2026",
        "version": 1,
        "data": {
          "report_no_fictional": "TR-2026-Q1-0088",
          "kind_label": "产品质量监督抽检",
          "sampled_at": "2026-03-03",
          "conclusion": "所检质量指标合格",
          "batches": [
            "B20260301",
            "B20260305"
          ],
          "tested_items": [
            "菌落总数",
            "大肠菌群",
            "铅",
            "食品添加剂"
          ],
          "scope_note": "仅证明抽样批次的质量指标合格，不证明任何成分含量宣称或功效"
        }
      },
      "prev_hash": "2f5bdc1ccdb66f51d031ac51033fe4300d625b3014af4290df71d96e060b3f5f",
      "hash": "82cd8d1c13ebf7b8bdb33d62a15c73c5d24544d5358b5b72c60c099163684b45"
    },
    {
      "seq": 6,
      "type": "entity.registered",
      "at": "2026-03-28T11:00:00+08:00",
      "actor": "u-zhouce",
      "payload": {
        "kind": "endorsement",
        "id": "ED-JIANGJQ",
        "version": 1,
        "data": {
          "celebrity": "江见青（虚构艺人）",
          "status": "active",
          "period": {
            "from": "2026-03-15",
            "to": "2026-09-30"
          },
          "channels": [
            "tmall",
            "jd"
          ],
          "audiences": [
            "成人普通消费者"
          ],
          "product_ids": [
            "PRD-TANG-001"
          ],
          "scope_note": "代言仅覆盖棠参饮一个SKU，授权渠道不含拼多多/快手"
        }
      },
      "prev_hash": "82cd8d1c13ebf7b8bdb33d62a15c73c5d24544d5358b5b72c60c099163684b45",
      "hash": "39017e1b5bbf6c1226d7d9b3aa5528535156a72b5872c2bc3e082a770cb5d821"
    },
    {
      "seq": 7,
      "type": "entity.registered",
      "at": "2026-03-06T15:00:00+08:00",
      "actor": "u-linzhiyao",
      "payload": {
        "kind": "packaging",
        "id": "PK-TANG",
        "version": 1,
        "data": {
          "product_id": "PRD-TANG-001",
          "name": "棠参饮正面包装 v1",
          "front_copy": "棠参饮｜人参配方，提神抗疲劳，熬夜必备",
          "markings": [],
          "category_ref": "category/CAT-BEVERAGE@v1",
          "recipe_ref": "recipe/RC-TANG@v1",
          "trademark_ref": "trademark/TM-TANGSHEN@v1",
          "endorsement_refs": [],
          "test_report_refs": [
            "test_report/TR-Q1-2026@v1"
          ],
          "legal_opinion_refs": [
            "legal_opinion/LO-01@v1"
          ],
          "claims": [
            {
              "key": "C1",
              "kind": "ingredient",
              "text": "人参配方",
              "ingredient": "人参（人工种植，5年及以下）",
              "require_min_per_100g": 0.3
            },
            {
              "key": "C2",
              "kind": "function",
              "text": "提神抗疲劳，熬夜必备"
            }
          ]
        }
      },
      "prev_hash": "39017e1b5bbf6c1226d7d9b3aa5528535156a72b5872c2bc3e082a770cb5d821",
      "hash": "4f6d3ba31534a7ff1e41586605b034a0ee9b43bfe49c23a59fc75717aeb14405"
    },
    {
      "seq": 8,
      "type": "entity.registered",
      "at": "2026-03-06T16:00:00+08:00",
      "actor": "u-zhouce",
      "payload": {
        "kind": "channel_page",
        "id": "CP-TMALL",
        "version": 1,
        "data": {
          "channel_id": "tmall",
          "title": "天猫旗舰店·棠参饮详情页",
          "url_fictional": "https://example.invalid/tmall/tang",
          "shown_packaging": "packaging/PK-TANG@v1"
        }
      },
      "prev_hash": "4f6d3ba31534a7ff1e41586605b034a0ee9b43bfe49c23a59fc75717aeb14405",
      "hash": "d1e7acce79425694127fa9754342791d06174bbafbfceeec46853d4ff2724446"
    },
    {
      "seq": 9,
      "type": "entity.registered",
      "at": "2026-03-06T16:10:00+08:00",
      "actor": "u-zhouce",
      "payload": {
        "kind": "channel_page",
        "id": "CP-PDD",
        "version": 1,
        "data": {
          "channel_id": "pdd",
          "title": "拼多多旗舰店·棠参饮详情页",
          "url_fictional": "https://example.invalid/pdd/tang",
          "shown_packaging": "packaging/PK-TANG@v1"
        }
      },
      "prev_hash": "d1e7acce79425694127fa9754342791d06174bbafbfceeec46853d4ff2724446",
      "hash": "a2873ac36edd39e4a829aa7c97fb922e8af86b6434dfda598d3ae9285806237b"
    },
    {
      "seq": 10,
      "type": "submission.created",
      "at": "2026-03-07T09:30:00+08:00",
      "actor": "u-linzhiyao",
      "payload": {
        "submission_id": "SUB-2026-001",
        "product_id": "PRD-TANG-001",
        "packaging_ref": "packaging/PK-TANG@v1",
        "channel_page_refs": [
          "channel_page/CP-TMALL@v1",
          "channel_page/CP-PDD@v1"
        ],
        "submitted_by": "u-linzhiyao",
        "evaluation": {
          "at": "2026-03-07T09:30:00+08:00",
          "packaging_ref": "packaging/PK-TANG@v1",
          "decision": "reject",
          "basis_notes": [],
          "results": [
            {
              "claim_key": "C1",
              "text": "人参配方",
              "kind": "ingredient",
              "status": "allowed",
              "supported_by": [
                {
                  "ref": "recipe/RC-TANG@v1",
                  "scope": "仅证明「棠参饮配方」配方版本含该成分，适用于按此配方生产的批次；实际含量以投料与成品检验为准"
                }
              ],
              "not_applicable": [],
              "gaps": []
            },
            {
              "claim_key": "C2",
              "text": "提神抗疲劳，熬夜必备",
              "kind": "function",
              "status": "blocked",
              "supported_by": [],
              "not_applicable": [
                {
                  "ref": "test_report/TR-Q1-2026@v1",